id	name	doc	is_pii	langs	contexts	translations.ru.name	translations.ru.doc	links.url	links.type
address	Address (physical location)	Geographic address, commonly consist of postindex, country, area, town, street and building	True	ru,common	common,pii,geo	Адрес (физическое местонахождение)	Географический или административный адрес местонахождения. Может включать почтовый индекс, название страны, региона, города, улицы и здания.	https://en.wikipedia.org/wiki/Address	wikipedia
atccode	Anatomical Therapeutic Chemical (ATC) Classification System	The Anatomical Therapeutic Chemical (ATC) Classification System is a drug classification system that classifies the active ingredients of drugs according to the organ or system on which they act and their therapeutic, pharmacological and chemical properties. Its purpose is an aid to monitor drug use and for research to improve quality medication use. It does not imply drug recommendation or efficacy.	False	ru	medical	Анатомо-терапевтическо-химическая классификация (АТХ)	Анатомо-терапевтическо-химическая классификация — международная система классификации лекарственных средств.	https://en.wikipedia.org/wiki/Anatomical_Therapeutic_Chemical_Classification_System	wikipedia
bankaccount	Bank account	A bank account is a financial account maintained by a bank or other financial institution in which the financial transactions between the bank and a customer are recorded.	False	ru	finances	Банковский счет	Банковский счёт — счёт, открываемый банком юридическим или физическим лицам для их участия в безналичном денежном обороте и аккумулировании на счёте безналичных денежных средств для целевого использования.	https://en.wikipedia.org/wiki/Bank_account	wikipedia
bankcard	Bank card (credit/debit card)	A bank card is typically a plastic card issued by a bank to its clients that performs one or more of a number of services that relate to giving the client access to bank account.	True	common	pii	Банковская карта	Ба́нковская ка́рта (англ. bank card) — пластиковая, металлическая или виртуальная карта, обычно привязанная к одному или нескольким расчётным счетам в банке.	https://en.wikipedia.org/wiki/Bank_card	wikipedia
bik	Russian bank identification code (BIK)	Russian bank identification code used as unique identifier of a credit organization (bank) and issued by Bank of Russia	False	ru	finances	Банковский идентификационный код	Банковский идентификационный код, БИК — уникальный идентификатор банка, используемый в платежных документах (платёжное поручение, аккредитив) на территории России. Классификатор БИКов ведёт Центробанк РФ (Банк России).	https://ru.wikipedia.org/wiki/Банковский_идентификационный_код	wikipedia
birthday	Birthday	A birthday is the anniversary of the birth of a person, or figuratively of an institution. Birthdays of people are celebrated in numerous cultures, often with birthday gifts, birthday cards, a birthday party, or a rite of passage.	True	common,ru	pii,datetime	День рождения	День рождения — годовщина рождения, соответствует дате рождения человека. 	https://en.wikipedia.org/wiki/Birthday	wikipedia
boolean	Boolean	In computer science, the Boolean data type is a data type that has one of two possible values (usually denoted true and false) which is intended to represent the two truth values of logic and Boolean algebra.	False	common,ru	common	Логический тип	Логи́ческий тип да́нных, или булев тип, или булевый тип (от англ. Boolean или logical data type) — примитивный тип данных в информатике, принимающий два возможных значения, иногда называемых истиной (true) и ложью (false).	https://en.wikipedia.org/wiki/Boolean_data_type	wikipedia
budgetcode	Russian government budget code	Budget codes issued by Ministry of Finances and Federal Treasury of Russia to all government and local budgets.	False	ru	government	Код бюджета	Уникальный код, присваеваемый каждому отдельному бюджету: федеральному, субъекта федерации и муниципалитету в Российской Федерации.		
budgetname	Russian government budget name	Name of the budget of Russian government at federal, regional or local level	False	ru	government	Наименование бюджета	Название бюджета по справочнику наименований и кодов бюджета ведомом Минфином России и Федеральным казначейством.		
city	City	A city is a large human settlement. It can be defined as a permanent and densely settled place with administratively defined boundaries whose members work primarily on non-agricultural tasks.	True	common,ru	geo,pii,common	Город	Го́род — крупный населённый пункт, жители которого заняты, как правило, не сельским хозяйством.	https://en.wikipedia.org/wiki/City	wikipedia
country	Country name	A country is a distinct territorial body or political entity. It may be an independent sovereign state or part of a larger state,[2] as a non-sovereign or formerly sovereign political division, a physical territory with a government, or a geographic region associated with sets of previously independent or differently associated peoples with distinct political characteristics.	False	common	geo	Название страны	Страна — территория, имеющая политические, физико-географические, культурные или исторические границы, которые могут быть как чётко определёнными и зафиксированными, так и размытыми (в таком случае нередко говорят не о границах, а о «рубежах»).	https://en.wikipedia.org/wiki/Country	wikipedia
countrycode_alpha2	ISO 3166-1 Alpha2 country code	ISO 3166-1 alpha-2 codes are two-letter country codes defined in ISO 3166-1, part of the ISO 3166 standard published by the International Organization for Standardization (ISO), to represent countries, dependent territories, and special areas of geographical interest.	False	common	geo	ISO 3166-1 alpha-2	ISO 3166-1 alpha-2 — система двухбуквенных кодов стран, определённая в ISO 3166-1, части стандарта ISO 3166, опубликованного Международной организацией по стандартизации (ISO) для обозначения стран, зависимых территорий и особых географических областей.	https://en.wikipedia.org/wiki/ISO_3166-1_alpha-2	wikipedia
countrycode_alpha3	ISO 3166-1 alpha-3 country code	ISO 3166-1 alpha-3 codes are three-letter country codes defined in ISO 3166-1, part of the ISO 3166 standard published by the International Organization for Standardization (ISO), to represent countries, dependent territories, and special areas of geographical interest.	False	common	geo	ISO 3166-1 alpha-3	ISO 3166-1 alpha-3 — система трехбуквенных кодов стран, определённая в ISO 3166-1, части стандарта ISO 3166, опубликованного Международной организацией по стандартизации (ISO) для обозначения стран, зависимых территорий и особых географических областей.	https://en.wikipedia.org/wiki/ISO_3166-1_alpha-3	wikipedia
csrcode	Russian budget target item of expenditure code	Russian budget target item of expenditure code	False	ru	government	Целевая статья расходов российского бюджета	Целевая статья расходов российского бюджета		
date	Date	Date with one of known notations	True	common,ru	datetime	Дата	Дата в одной из общепринятых нотаций	https://en.wikipedia.org/wiki/Date_and_time_notation	wikipedia
datetime	Date and time	Date and time with one of known notations	True	common,ru	datetime	Дата и время	Дата и время в одной из общепринятых нотаций	https://en.wikipedia.org/wiki/Date_and_time_notation	wikipedia
dayofmonth	Day of month	Month day, numeric value from 1 to 31	True	common,ru	datetime				
deathday	Date of death	Date of death of the person	True	common,ru	pii	Дата смерти	Дата смерти человека	https://en.wikipedia.org/wiki/Death_anniversary	wikipedia
doi	Digital Object Identifier (DOI)	A digital object identifier (DOI) is a persistent identifier or handle used to identify objects uniquely, standardized by the International Organization for Standardization (ISO).	False	common	science	Цифровой идентификатор объекта (DOI)	Цифровой идентификатор объекта (англ. digital object identifier (DOI), дискретный объекта идентификатор (ДОИ)) — основной элемент системы ДОИ, предназначенной для обозначения объектов информационной деятельности.	https://en.wikipedia.org/wiki/Digital_object_identifier	wikipedia
email	Email (Electronic mail)	"Electronic mail (email or e-mail) is a method of exchanging messages (""mail"") between people using electronic devices. Email was thus conceived as the electronic (digital) version of, or counterpart to, mail, at a time when ""mail"" meant only physical mail (hence e- + mail)."	True	common,ru	common,pii	Электронная почта (email)	Электро́нная по́чта (англ. email, e-mail [iˈmeɪl], от англ. electronic mail) — технология и служба по пересылке и получению электронных сообщений (называемых «письма», «электронные письма» или «сообщения») между пользователями компьютерной сети (в том числе — Интернета).	https://en.wikipedia.org/wiki/Email	wikipedia
encompanyname	Company/business name in English	English written company/business/legal name of business entity	False	en	companies	Название компании на английском языке	Название компании написанное на английском языке		
endayofweek	Day of week (in English)	English names of the week days	False	en	datetime	День недели (на английском)	Название для недели на английском языке	https://en.wikipedia.org/wiki/Workweek_and_weekend	wikipedia
enmonth	Month name (English)	English name of the month	False	en	datetime	Название месяца (на английском)	Название месяца написанное на английском языке	https://en.wikipedia.org/wiki/Month	wikipedia
enmonthshort	Short name of month (English)	Abbreviated short English name/abbreviation of month	False	en	datetime	Месяц, краткое название (английский)	Краткое название месяца на английском языке	https://en.wikipedia.org/wiki/Month	wikipedia
eui48	MAC Address (EUI48) of the device	A media access control address (MAC address) is a unique identifier assigned to a network interface controller (NIC) for use as a network address in communications within a network segment.	True	common	internet,pii				
fedgrbs	Russian direct government budget receiver and distributor code	3 digits code of the Russian direct government budget receiver and distributor. Assigned to each government ministry, agency, service and some other budget distributor organizations	False	ru	government				
filename	Name of the file	File name with common notation like somefile.ext	False	common	common				
gender	Gender	Gender flag and/or any other identification value	True	common	pii				
geopoint	Geopoint	Geographic point as string with latitude and longitude	True	common	geo				
guid	GUID (Globally unique identifier)	A universally unique identifier (UUID) is a 128-bit label used for information in computer systems. The term globally unique identifier (GUID) is also used.	False	common	identifiers				
inn	INN (Russian tax identifier)	Russian organization/person tax identification number (INN) is unique for each person and organization.	False	ru	companies				
ipaddr	IPv4 or IPv6 address	Internet Protocol version 4 (IPv4) or Internet Protocol version 6 (IPv6) address	True	common	internet,pii				
ipsubnet	IPv4 or IPv6 subnet	Subnetwork of IPv4 or IPv6 addresses	True	common	internet				
ipv4	Internet Protocol version 4 (IPv4)	Internet Protocol version 4 (IPv4) is the fourth version of the Internet Protocol (IP). It is one of the core protocols of standards-based internetworking methods in the Internet and other packet-switched networks.	True	common	internet,pii				
ipv4subnet	IPv4 subnet	Subnetwork of IPv4 addresses	True	common	internet				
ipv6	Internet Protocol version 6 (IPv6)	Internet Protocol version 6 (IPv6) is the most recent version of the Internet Protocol (IP), the communications protocol that provides an identification and location system for computers on networks and routes traffic across the Internet.	True	common	internet,pii				
isbn10	International Standard Book Number 10-digits (ISBN10)	The International Standard Book Number (ISBN) is a numeric commercial book identifier that is intended to be unique. Publishers purchase ISBNs from an affiliate of the International ISBN Agency	False	common	objectids			https://en.wikipedia.org/wiki/International_Standard_Book_Number	wikipedia
isbn13	International Standard Book Number 13-digits (ISBN13)	The International Standard Book Number (ISBN) is a numeric commercial book identifier that is intended to be unique. Publishers purchase ISBNs from an affiliate of the International ISBN Agency	False	common	objectids			https://en.wikipedia.org/wiki/International_Standard_Book_Number	wikipedia
kbk	Russian budget classification code (KBK)	Russian budget classification code KBK (kod byudzhetnoy klassifikacii) identifiers certain budget allocation of the federal or regional budget	False	ru	government	Код бюджетной классификации (КБК)	Код бюджетной классификации (КБК) используется в бюджетной системе РФ для идентификации конкретной строки расхода федерального или регионального государственного бюджета.		
kladr	KLADR code (Russian)	Russian unique codes assigned by Government Tax Service for every administrative address in Russian federation. Replaces by FIAS government system	False	ru	geo	Код КЛАДР	КЛАДР — ведомственный классификатор ФНС России, созданный для распределения территорий между налоговыми инспекциями и автоматизированной рассылки корреспонденции. Заменен системой ФИАС		
kosgucode	Russian Public Administration Sector Classification Code (KOSGU) 	Russian Public Administration Sector Classification Code (KOSGU) used in Russian budget planning and procurement	False	ru	government	Код КОСГУ	Код классификации секторов государственного управления используемые в Российской бюджетной системе		
kpp	Russian company supplemental registration code (KPP)	Russian company supplemental registration code (KPP). Used in combination with Taxpayer INN code	False	ru	companies	Код постановки на учёт (КПП)	Вспомогательный код используемый вместе с кодом ИНН для идентификации налоговой принадлежности компании.		
kvrcode	Russian budget expense type code (KVR)	Russian budget expense type code (KVR) used in budget planning and procurement	False	ru	government	Код вида расходов (КВР)	Код вида расходов (КВР) используется как часть кода бюджетной классификации в процессах связанных с бюджетированием и госзакупками в Российской Федерации		
kvrname	Russian budget expense type code name (KVR)	Russian budget expense type code (KVR) used in budget planning and procurement	False	ru	government	Наименование кода вида расходов (КВР)	Код вида расходов (КВР) используется как часть кода бюджетной классификации в процессах связанных с бюджетированием и госзакупками в Российской Федерации		
languagetag	IETF language tag	An IETF BCP 47 language tag is a standardized code or tag that is used to identify human languages in the Internet. The tag structure has been standardized by the Internet Engineering Task Force (IETF) in Best Current Practice (BCP) 47; the subtags are maintained by the IANA Language Subtag Registry.	False	common	geo	Языковой код IETF	Языковой код/тэг по стандарту IETF BCP 47 идентифицирующий конкретный человеческий язык, стиль написания и тд.	https://en.wikipedia.org/wiki/IETF_language_tag	wikipedia
latitude	Latitude	In geography, latitude is a geographic coordinate that specifies the north–south position of a point on the Earths surface. Latitude is an angle (defined below) which ranges from 0° at the Equator to 90° (North or South) at the poles.	False	common,ru	geo,common			https://en.wikipedia.org/wiki/Latitude	wikipedia
licaccount	Personal account (Russian)	A personal account is an account for use by an individual for that persons own needs. It is a relative term to differentiate them from those accounts for business or corporate use.	False	common,ru	finances	Лицевой счет	Лицевой счёт (англ. personal account) — бухгалтерский счёт для ведения учёта расчетов с физическими и юридическими лицами, на котором отражаются все финансово-кредитные операции с определенным клиентом, является документом аналитического учёта.		
longitude	Longitude	Longitude is a geographic coordinate that specifies the east–west position of a point on the Earths surface, or the surface of a celestial body. It is an angular measurement, usually expressed in degrees and denoted by the Greek letter lambda (λ)	False	common,ru	geo,common			https://en.wikipedia.org/wiki/Longitude	wikipedia
md5hash	MD5 hash	Result of the MD5 hash function. Commonly used to generate hash of from file or data or to use as unique identifier	False	common	crypto			https://en.wikipedia.org/wiki/MD5	wikipedia
mimetype	Multipurpose Internet Mail Extensions (MIME)	Mime type of the file/content. Used to identify contents of the stream or file. The MIME standard is specified in a series of requests for comments: RFC 2045, RFC 2046, RFC 2047, RFC 4288, RFC 4289 and RFC 2049.	False	common	common			https://en.wikipedia.org/wiki/MIME	wikipedia
mongodbid	MongoDB unique record ID	MongoDB unique id assigned to each row of each collection in MongoDB as field _id	False	common	crypto				
month	Month	Month as number since start of the year. Could be from 1 to 12	False	common	datetime				
nationality	Person nationality	Nationality of the person from list of unique code from one of code lists or defined somehow else.	True	common	pii				
ogrn	Russian primary government identification number (OGRN)	Russian primary government identification number assigned by Tax Service to any business entity in Russia	False	ru	companies	Основной государственный регистрационный номер (ОГРН)	ОГРН (основной государственный регистрационный номер) — государственный регистрационный номер записи о создании юридического лица либо записи о первом представлении в соответствии с федеральным законом Российской Федерации «О государственной регистрации юридических лиц» сведений о юридическом лице, зарегистрированном до введения в действие указанного Закона (пункт 8 Правил ведения Единого государственного реестра юридических лиц).		
ogrn_ogrnip	Russian primary government identification number (OGRN and OGRNIP)	Russian primary government identification number assigned by Tax Service to any business entity (OGRN) in Russia and sole prprietors (OGRNIP)	False	ru	companies	Код ОГРН или ОГРНИП	Основной государственный регистрационный номер индивидуального предпринимателя или ОГРН (основной государственный регистрационный номер)		
okato	OKATO (Russian Classification on Objects of Administrative Division)	Russian Classification on Objects of Administrative Division (Russian: Общеросси́йский классифика́тор объе́ктов администрати́вно-территориа́льного деле́ния), or OKATO (Russian: ОКАТО), also called All-Russian classification on units of administrative and territorial distribution in English, is one of several Russian national registers. OKATOs purpose is organization of information about structure of the administrative divisions of the federal subjects of Russia.	False	ru	geo	Код ОКАТО	 Общероссийский классификатор объектов административно-территориального деления (сокращ. ОКАТО — общероссийский классификатор административно-территориальных образований) — классификатор объектов административно-территориального деления Российской Федерации, входит в состав «Единой системы классификации и кодирования технико-экономической и социальной информации Российской Федерации» (ЕСКК). ОКАТО предназначен для обеспечения достоверности, сопоставимости и автоматизированной обработки информации в разрезах административно-территориального деления в таких сферах, как статистика, экономика и другие.	https://en.wikipedia.org/wiki/OKATO	wikipedia
