id	name	doc	is_pii	langs	contexts	translations.ru.name	translations.ru.doc	links.url	links.typeokei	Russian OKEI code (classifier of units of measurement)	Russian OKEI (classifier of units of measurement)	False	ru	common	Код ОКЕИ (Общероссийский классификатор единиц измерения)	Общероссийский классификатор единиц измерения — это общероссийский классификатор, предназначенный для использования при решении задач количественной оценки технико-экономических и социальных показателей в целях осуществления государственного учета и отчетности, анализа и прогнозирования развития экономики, обеспечения международных статистических сопоставлений, осуществления внутренней и внешней торговли, государственного регулирования внешнеэкономической деятельности и организации таможенного контроля.		
okeiname	Russian OKEI name of code (classifier of units of measurement)	Russian OKEI (classifier of units of measurement)	False	ru	common	Наименование кода по ОКЕИ (Общероссийский классификатор единиц измерения)	Общероссийский классификатор единиц измерения — это общероссийский классификатор, предназначенный для использования при решении задач количественной оценки технико-экономических и социальных показателей в целях осуществления государственного учета и отчетности, анализа и прогнозирования развития экономики, обеспечения международных статистических сопоставлений, осуществления внутренней и внешней торговли, государственного регулирования внешнеэкономической деятельности и организации таможенного контроля.		
okfs	Russian form of ownership code	Russian classifier of forms of ownership, OKFS	False	ru	common	Код ОКФС	ОКФС — это общероссийский классификатор форм собственности, входящий в Единую систему кодирования РФ		
okogu	Russian government and governance code (OKOGU)	Russian government and governance code. OKOGU classifier	False	ru	common	Код ОКОГУ	ОКОГУ -  это общероссийский классификатор органов государственной власти и управления		
okopf	Code of type of business entity (Russian, OKOPF)	Code of type of business entity in Russia, classifier OKOPF	False	ru	companies,common	Код организационно-правовая формы по ОКОПФ	Код организационно-правовой формы юридического лица по справочнику ОКОПФ		
okopfname	Type of business entity (Russian, OKOPF)	Type of business entity in Russia, classifier OKOPF	False	ru	companies	Организационно-правовая форма	Наименование организационно-правовой формы юридического лица по справочнику ОКОПФ		
okpd	Russian product code (OKPD)	Russian product code (OKPD) used for government procurement and budget planning purposes	False	ru	common	Код ОКПД	Код по Общероссийскому классификатору продукции		
okpo	Russian organization stat code	Russian organizations statistical code (OKPO) issued by Rosstat	False	ru	companies	Код ОКПО	Код по Общероссийскому классификатору предприятий и организаций		
oktmo	Russian Classification of Territories of Municipal Formations (OKTMO) code	Russian Classification of Territories of Municipal Formations (Russian: Общероссийский классификатор территорий муниципальных образований), or OKTMO (Russian: ОКТМО), is one of several Russian national registers. OKTMO organizes information about the structure of the municipal divisions of Russia.	False	ru	common	Код ОКТМО	Общероссийский классификатор территорий муниципальных образований (сокращ. ОКТМО) — классификатор объектов административно-территориального деления Российской Федерации, входит в состав «Единой системы классификации и кодирования технико-экономической и социальной информации Российской Федерации» (ЕСКК).	https://en.wikipedia.org/wiki/OKTMO	wikipedia
oktmoname	Russian Classification of Territories of Municipal Formations (OKTMO) name	Russian Classification of Territories of Municipal Formations (Russian: Общероссийский классификатор территорий муниципальных образований), or OKTMO (Russian: ОКТМО), is one of several Russian national registers. OKTMO organizes information about the structure of the municipal divisions of Russia.	False	ru	common	Наименование из справочника ОКТМО	Общероссийский классификатор территорий муниципальных образований (сокращ. ОКТМО) — классификатор объектов административно-территориального деления Российской Федерации, входит в состав «Единой системы классификации и кодирования технико-экономической и социальной информации Российской Федерации» (ЕСКК).	https://en.wikipedia.org/wiki/OKTMO	wikipedia
okvalpha	Russian currency code	Russian currency codes (OKV classifier)	False	ru	common	Код валюты по ОКВ	Код валюты по справочнику ОКВ (Общероссийский классификатор валют)		
okved	Russian economic classification code (OKVED)	Russian economic classification code (OKVED)	False	ru	common	Код ОКВЭД	Код по общероссийскому классификатору видов экономической деятельности		
okvname	Russian currency name	Russian currency names (OKV classifier)	False	ru	common	Название валюты по ОКВ	Название валюты по справочнику ОКВ (Общероссийский классификатор валют)		
orcid	Open Researcher and Contributor ID (ORCID)	The ORCID, Open Researcher and Contributor ID) is a nonproprietary alphanumeric code to uniquely identify authors and contributors of scholarly communication as well as ORCIDs website and services to look up authors and their bibliographic output (and other user-supplied pieces of information).	False	common	science			https://en.wikipedia.org/wiki/ORCID	wikipedia
orgname	Company name	Name of the organization/business/company in any language	False	ru,common	companies				
passport	Passport number (universal)	Person passport, usually unique personal information that should be shared online. Identifies personal document issued to person by government authority	True	ru,common	pii				
password	Password	Passwords, usually associated with login/username/email.	True	common	pii				
person_firstname	Person firstname	First name of the person. For example, Donald or Vladimir or Jack	True	ru,common	persons,pii				
person_fullname	Person fullname	Full name of the person as combination of last, first, and sometimes middle name	True	ru	persons,pii				
person_midname	Person middle name	Middle name of the person	True	ru,common	persons,pii				
person_surname	Person surname/lastname	Last name of the person. For example, Smith or Ivanova	True	ru,common	persons,pii				
phone	Phone number	Number of phone/fax	True	common,ru	pii,common				
postindex	Postal code/index	Postal index/code, unique post identifier used in address	True	common,ru	geo,pii,common	Почтовый индекс	Индекс почтовой связи		
ppocode	Russian public legal formation code	Russian public legal formation is a legal definition of public entity with right of administration of its level budget	False	ru	government	Код публично правового образования в РФ	Публично правовое образование - это организация/субъект федерации с правом распоряжения бюджетом своего уровня		
pponame	Russian public legal formation name	Russian public legal formation is a legal definition of public entity with right of administration of its level budget	False	ru	government	Наименование публично правового образования в РФ	Публично правовое образование - это организация/субъект федерации с правом распоряжения бюджетом своего уровня		
rnfi	Russian government property ID (RNFI)	Russian government federal property unique ID (RNFI)	False	ru	government				
ruikuiko	Russian government customers unique code	Unique code assigned to all government customers in Russian Federation	False	ru	government	Идентификационный код заказчика	Код присваиваемый государственным заказчикам в Российской Федерации		
ruikz	Russian government procurement unique id	Unique id assigned to all government procurement procedures in Russian Federation	False	ru	government	Идентификационный код закупки	Код присваиваемый государственным закупкам в Российской Федерации		
ruintpassport	Russian passport number	Number of Russian internal passport	True	ru	pii	Номер паспорта (РФ)	Номер внутреннего паспорта в Российской Федерации		
rukadastr	Russian land registry number	Russian land registry number (kadastroviy nomer, cadaster number) assigned to each land, territory, building and other geographic administrative objects by Rosreestr	False	ru	geo	Кадастровый номер	Када́стровый но́мер — уникальный номер объекта недвижимости, присваиваемый ему при осуществлении кадастрового и технического учёта.		
rumedicineregnum	Registration code of medicine (Russian)	Russian medicine registration code	False	ru	medical	Код регистрации лекарственного средства в России	Код регистрации лекарственного средства в России. Реестр Росздравнадзора 		
rumedicinetradename	Medicine trade name (Russian)	Trade name of the medicine in Russian.	False	ru	medical	Торговое наименование лекарственного средства	Торговое название для лекарственных средств		
rumedmnn	International nonproprietary name (Russia)	An international nonproprietary name (INN) is an official generic and non-proprietary name given to a pharmaceutical drug or an active ingredient. (Russian)	False	ru	medical	Международное непатентованное наименование	Международное непатентованное наименование (МНН) — уникальное наименование действующего вещества лекарственного средства, рекомендованное Всемирной организацией здравоохранения (ВОЗ).		
rumosadmareas	Moscow administrative areas (Russia)	Moscow city (Russia) administrative areas	False	ru	common	Районы города Москвы	Справочник районов города Москвы		
rumosdistricts	Moscow districts (Russia)	Moscow city (Russia) districts	False	ru	common	Округа города Москвы	Округа города Москвы		
runpa	Russian regulatory legal act	Russian regulatory legal act. For example: Executive order	False	ru	government	Нормативно-правовой документ	Нормативно-правовой документ в России. Например, постановление правительства		
runpakind	Russian regulatory legal act type	Type of the Russian legal document: order, executive order and so on	False	ru	government	Тип нормативного документа	Тип нормативного документа, например: указ, постановление, приказ		
ruscity	City name (Russian)	City name in Russian language	True	ru	common,pii	Название города (на русском)	Наименование города/городского поселения на русском языке. Например, Череповец		
ruscountrycode	Country code (Russian)	Country codes and abbreviations used in Russia	False	ru	common	Код страны (на русском)	Код страны использующий коды и аббревиатуры принятые в России		
ruscountryname	Country name (Russian)	Name of the country written in Russian language.	False	ru	geo	Названи страны (на русском)	Название страны на русском языке. Например, Колумбия		
rusdayofweek	Day of week (in Russian)	Day of week written in Russian language	False	ru	datetime	День недели (на русском)	День недели написанный на русском языке. Например, вторник		
rusdegree	Academic degree (Russian)	Academic degree title in Russian. 	False	ru	persons	Научная степень (на русском)	Научная степень персоны на русском языке. Например, кандидат технических наук	https://en.wikipedia.org/wiki/Academic_degree	wikipedia
rusfeddistrict	Russian federal district name	Name of the federal district of Russia. Full or short.	False	ru	common	Наименование федерального округа России	Наименование федерального округа России полное или сокращённое		
rusnils	Individual insurance account number (SNILS)	Russian social insurance identifier. Issued for every insured person by Pension fund of Russia	True	ru	pii	Код СНИЛС	Страховой номер индивидуального лицевого счёта физического лица (СНИЛС)		
rusregion	Russian region (federal subject) name	Name of the region (federal subject) in Russia as it is in country Constitution	False	ru	common	Наименование субъекта Российской Федерации	Наименование субъекта Российской Федерации по Конституции страны		
rusregioncode	Russian region unique code	Russin unique code of country subdivision (regions/federal subjects)	False	ru	common	Код субъекта Российской Федерации	Код субъекта Российской Федерации по нумерации в Конституции страны		
rustimerange	Time range (Russian)	Time range written in Russian	False	ru	datetime	Временной промежуток (на русском)	Временной промежуток на русском языке. Например, с 9:00 до 14:00		
rustreet	Street name (Russian)	Street name writtern in Russian language	True	ru	common,pii	Улица (на русском)	Улица (на русском языке). Обычно является составной частью адреса		
rusworkposition	Work position / Job title (Russian)	Work positions / job title common in Russia and writtern in Russian language.	False	ru	persons	Должность	Должность персоны на русском языке.		
sha1hash	SHA-1 hash	SHA-1 hash from file or data. Sometimes used as unique id of the data record	False	common	crypto			https://en.wikipedia.org/wiki/SHA-1	wikipedia
sha256hash	SHA256 hash	SHA256 hash from file or data. Sometimes used as unique id of the data record	False	common	crypto			https://en.wikipedia.org/wiki/SHA-2	wikipedia
street	Street	Name of the street, commonly used in address	True	common,ru	geo,pii,common				
swiftcode	Bank SWIFT code (ISO 9362)	ISO 9362 defines a standard format of Business Identifier Codes (also known as SWIFT-BIC, BIC, SWIFT ID or SWIFT code) approved by the International Organization for Standardization (ISO).	False	ru	finances			https://en.wikipedia.org/wiki/ISO_9362	wikipedia
time	Time	Time of the day, like 12:00 or 10PM or 11:05	False	common,ru	datetime				
timerange	Time range	Range between two points of time, like 8:00-21:00 or 8:00AM-1:00PM	False	common	datetime				
timestamp	Digital timestamp (Unix time)	Digital timestamp defined as Unix Time. It is a system for describing a point in time. It is the number of seconds that have elapsed since the Unix epoch, excluding leap seconds.	False	common	datetime			https://en.wikipedia.org/wiki/Unix_time	wikipedia
timezone	Time zone	A time zone is an area that observes a uniform standard time for legal, commercial and social purposes	False	common	datetime			https://en.wikipedia.org/wiki/Time_zone	wikipedia
tnved	Russian TNVED code (product code)	TN VED is a Russian classifier used to identify product groups for customs purposes and international trade statistics.	False	ru	common	Код ТНВЭД	Товарная номенклатура внешнеэкономической деятельности Евразийского экономического союза		
tofkcode	Russian Federal treasury division code	Unique id of the Russian Federal treasury division.	False	ru	government	Код территориального управления Федерального казначейства РФ	Код территориального управления Федерального казначейства РФ. Синхронизовано с наименованием территориального управления, ведомственный справочник.		
tofkname	Russian Federal treasury division name	Name of the Russian Federal treasury division	False	ru	government	Наименование территориального управления Федерального казначейства РФ	Наименование территориального управления Федерального казначейства РФ. Синхронизовано с кодом территориального управления, ведомственный справочник.		
udkindex	Russian bibliographic index (UDK)	Russian bibliographic classifier (UDK)	True	ru	common	Индекс УДК (универсальная десятичная классификация)	 Универса́льная десяти́чная классифика́ция — система классификации информации, широко используется во всём мире для систематизации произведений науки, литературы и искусства, периодической печати, различных видов документов и организации картотек. 		
ukbnfcode	BNF code	The British National Formulary (BNF) is a reference book containing the standard list of medicines used in UK prescribing. It gives information on the indications, dosages and side effects for over 70,000 medicines.	False	en	medical			https://www.thedatalab.org/blog/2017/04/prescribing-data-bnf-codes/	other
ukwardcode	Ward code (United Kingdom)	The wards and electoral divisions in the United Kingdom are electoral districts at sub-national level represented by one or more councillors.	False	en	geo			https://en.wikipedia.org/wiki/Wards_and_electoral_divisions_of_the_United_Kingdom	wikipedia
ukwardname	Ward name (United Kingdom)	The wards and electoral divisions in the United Kingdom are electoral districts at sub-national level represented by one or more councillors.	False	en	geo			https://en.wikipedia.org/wiki/Wards_and_electoral_divisions_of_the_United_Kingdom	wikipedia
url	Uniform Resource Locator (URL)	A Uniform Resource Locator (URL), colloquially termed a web address, is a reference to a web resource that specifies its location on a computer network and a mechanism for retrieving it. A URL is a specific type of Uniform Resource Identifier (URI), although many people use the two terms interchangeably	False	common,ru	common			https://en.wikipedia.org/wiki/URL	wikipedia
username	Username	Name of the user or login, commonly used for authentication or user identification purposes	True	common	pii				
uuid	A universally unique identifier (UUID)	A universally unique identifier (UUID) is a 128-bit label used for information in computer systems. The term globally unique identifier (GUID) is also used.	False	common	identifiers			https://en.wikipedia.org/wiki/Universally_unique_identifier	wikipedia
vehiclenumber	Vehicle number	Number of the vehicle (vehicle plate number)	False	common	vehicles				
year	Year	A calendar year in western notation like 2022 or 1913	False	common,ru	datetime			https://en.wikipedia.org/wiki/Year	wikipedia
